{
  "schema": "refcut-blueprint-0.1",
  "meta": {
    "reference": "fixtures\\test_reference.mp4",
    "fps": 30.0,
    "resolution": [
      1280,
      720
    ],
    "duration": 6.467,
    "shot_count": 6
  },
  "global_style": {
    "summary": "A tight, beat-locked motion-graphics edit: hard cuts every 0.7-1.5s landing on a ~120 BPM percussion track, one white flash-frame punctuation, continuous push/pull camera moves inside every shot, and fully saturated synthetic color fields. The core language is: hit the beat with a cut, keep the frame moving with a slow zoom, and use a flash frame to reset the eye between contrasting color worlds.",
    "pacing": {
      "character": "driving, beat-locked, accelerating feel from alternating zoom directions",
      "avg_shot_s": 1.08
    },
    "color": {
      "treatment": "saturated synthetic primaries; each shot is its own color world, no unified grade",
      "saturation": "very high",
      "contrast": "high within shots",
      "grain": "none, clean digital"
    },
    "sound": {
      "music": "metronomic percussion/click track ~120 BPM, no melody",
      "sfx_palette": [
        "bass impact (heavy, at 1.5s)"
      ],
      "sync_policy": "cuts land on onsets; the 1.5s cut lands exactly on the heaviest bass impact"
    },
    "motion_language": "every shot carries a continuous slow zoom; zoom direction alternates between consecutive shots (in, in, none, out, none, none); cuts handle big moves, zooms handle small ones; handheld jitter only inside the fractal shot",
    "text_style": {
      "placement": null,
      "animation": null,
      "font_feel": null
    },
    "recurring_patterns": [
      {
        "id": "P1",
        "name": "cut-on-impact",
        "description": "shot changes align to audio onsets; the strongest bass impact coincides with the 1.5s cut (measured delta 14ms)"
      },
      {
        "id": "P2",
        "name": "perpetual push/pull",
        "description": "every textured shot has a slow continuous zoom; direction alternates to create breathing rhythm"
      },
      {
        "id": "P3",
        "name": "flash punctuation",
        "description": "a single white flash frame separates contrasting color worlds and acts as a beat separator"
      }
    ]
  },
  "audio_map": {
    "bpm": 119.1,
    "beat_times": [
      0.466,
      0.97,
      1.474,
      1.978,
      2.482,
      2.986,
      3.49,
      3.994,
      4.498,
      5.002,
      5.506,
      6.01
    ],
    "impacts": [
      {
        "t": 0.488,
        "bass": 4.81
      },
      {
        "t": 1.486,
        "bass": 4.75
      },
      {
        "t": 1.997,
        "bass": 5.35
      },
      {
        "t": 2.485,
        "bass": 4.41
      },
      {
        "t": 2.995,
        "bass": 5.05
      },
      {
        "t": 3.483,
        "bass": 3.96
      },
      {
        "t": 3.994,
        "bass": 5.31
      },
      {
        "t": 4.481,
        "bass": 3.42
      },
      {
        "t": 4.992,
        "bass": 5.2
      },
      {
        "t": 5.48,
        "bass": 2.8
      },
      {
        "t": 5.991,
        "bass": 4.96
      }
    ],
    "silences": [
      [
        0.05,
        0.5
      ],
      [
        0.55,
        1.0
      ],
      [
        1.05,
        1.5
      ],
      [
        1.65,
        2.0
      ],
      [
        2.05,
        2.5
      ],
      [
        2.55,
        3.0
      ],
      [
        3.05,
        3.5
      ],
      [
        3.55,
        4.0
      ],
      [
        4.05,
        4.5
      ],
      [
        4.55,
        5.0
      ],
      [
        5.05,
        5.5
      ],
      [
        5.55,
        6.0
      ],
      [
        6.05,
        6.45
      ]
    ]
  },
  "timeline": [
    {
      "id": "SHOT_01",
      "start": 0.0,
      "duration": 1.5,
      "content": {
        "footage_required": "abstract motion-graphics test card: vertical color bars with sweeping diagonal light lines and a slowly rotating dotted arc; any high-saturation graphic with continuous internal motion works",
        "framing": "full-frame graphic, no subject",
        "subject_motion": "diagonal lines sweep across the frame; dotted arc rotates top-right",
        "on_screen_text": null
      },
      "timing": {
        "speed_curve": [
          {
            "t": 0.0,
            "v": 100
          },
          {
            "t": 1.0,
            "v": 100
          }
        ],
        "speed_feel": "none"
      },
      "transform": {
        "scale": {
          "direction": "in",
          "end_scale_pct": 112.3
        },
        "scale_curve": [
          {
            "t": 0.033,
            "scale_pct": 100.0
          },
          {
            "t": 0.133,
            "scale_pct": 100.1
          },
          {
            "t": 0.267,
            "scale_pct": 101.7
          },
          {
            "t": 0.4,
            "scale_pct": 101.5
          },
          {
            "t": 0.533,
            "scale_pct": 103.3
          },
          {
            "t": 0.667,
            "scale_pct": 102.6
          },
          {
            "t": 0.8,
            "scale_pct": 104.3
          },
          {
            "t": 0.933,
            "scale_pct": 106.3
          },
          {
            "t": 1.067,
            "scale_pct": 107.8
          },
          {
            "t": 1.2,
            "scale_pct": 109.6
          },
          {
            "t": 1.333,
            "scale_pct": 111.2
          },
          {
            "t": 1.467,
            "scale_pct": 112.3
          }
        ]
      },
      "effects": {
        "camera_shake": {
          "level": "medium",
          "measured_px": 2.98
        }
      },
      "transition_in": {
        "type": "start",
        "measured": {
          "type": "start"
        },
        "note": "video opens cold on this shot"
      },
      "text": [],
      "audio": [],
      "color": {
        "measured": {
          "avg_hex": "#7b827d",
          "saturation_mean": 249.5,
          "luma_contrast": 13.8
        },
        "grade": "inherit_global"
      },
      "pattern_refs": [
        "P2"
      ],
      "confidence": 0.9,
      "provenance": {
        "measured": [
          "scale 112.3% over shot",
          "shake medium (2.98px)"
        ],
        "inferred": []
      }
    },
    {
      "id": "SHOT_02",
      "start": 1.5,
      "duration": 0.7,
      "content": {
        "footage_required": "organic fractal/mandelbrot-style bloom centered on a soft pink-lavender field; any organic detail-rich form that reads as 'zooming into a structure'",
        "framing": "centered macro on the fractal body",
        "subject_motion": "camera pushes into the fractal while the form itself breathes; visible handheld jitter",
        "on_screen_text": null
      },
      "timing": {
        "speed_curve": [
          {
            "t": 0.0,
            "v": 100
          },
          {
            "t": 1.0,
            "v": 100
          }
        ],
        "speed_feel": "none"
      },
      "transform": {
        "scale": {
          "direction": "in",
          "end_scale_pct": 112.1
        },
        "scale_curve": [
          {
            "t": 1.533,
            "scale_pct": 100.7
          },
          {
            "t": 1.567,
            "scale_pct": 101.3
          },
          {
            "t": 1.633,
            "scale_pct": 102.5
          },
          {
            "t": 1.7,
            "scale_pct": 103.7
          },
          {
            "t": 1.733,
            "scale_pct": 104.2
          },
          {
            "t": 1.8,
            "scale_pct": 105.6
          },
          {
            "t": 1.867,
            "scale_pct": 106.7
          },
          {
            "t": 1.933,
            "scale_pct": 107.9
          },
          {
            "t": 1.967,
            "scale_pct": 108.4
          },
          {
            "t": 2.033,
            "scale_pct": 109.7
          },
          {
            "t": 2.1,
            "scale_pct": 110.9
          },
          {
            "t": 2.167,
            "scale_pct": 112.1
          }
        ]
      },
      "effects": {
        "camera_shake": {
          "level": "medium",
          "measured_px": 4.21
        },
        "motion_blur": {
          "level": "light"
        },
        "other": [
          "handheld jitter synced to the bass hit"
        ]
      },
      "transition_in": {
        "type": "hard_cut",
        "measured": null,
        "note": "hard cut on the heavy bass impact at 1.5s; total color-world change from saturated bars to pastel field"
      },
      "text": [],
      "audio": [
        {
          "op": "impact_sfx",
          "at": 1.5,
          "note": "bass impact measured at cut",
          "source": "measured"
        },
        {
          "op": "align_to_beat",
          "beat_time": 1.486,
          "delta_s": 0.014000000000000012,
          "source": "measured"
        }
      ],
      "color": {
        "measured": {
          "avg_hex": "#b081a9",
          "saturation_mean": 135.1,
          "luma_contrast": 47.5
        },
        "grade": "inherit_global"
      },
      "pattern_refs": [
        "P1",
        "P2"
      ],
      "confidence": 0.85,
      "provenance": {
        "measured": [
          "scale 112.1% over shot",
          "shake medium (4.21px)"
        ],
        "inferred": [
          "motion blur light",
          "other: ['handheld jitter synced to the bass hit']"
        ]
      }
    },
    {
      "id": "SHOT_03",
      "start": 2.267,
      "duration": 1.0,
      "content": {
        "footage_required": "calibration bars (SMPTE-style): totally static, flat, reference-frame aesthetic; any static 'bench' image works as the palate cleanser",
        "framing": "full-frame static bars",
        "subject_motion": "none; the stillness is the point",
        "on_screen_text": null
      },
      "timing": {
        "speed_curve": [
          {